timestamp,username,tweet,mentions,hashtags,likes,retweets,comments,replies,views,compound,sentiment,topic
2025-06-28 17:27:50,xdeputyHQ,source microfinance bank needs hire direct sales agent got relevant experience could good share someone might need details direct sales agent,,"hiring,jobs,XDeputy",0,0,0,0,20,0.6249,positive,1
2025-06-28 17:27:04,xdeputyHQ,stanbic ibtc needs hire banker business abia got relevant experience could good share someone might need details banker business ab,,"hiring,jobs,XDeputy",0,0,0,0,16,0.6249,positive,1
2025-06-28 17:26:54,xdeputyHQ,oilserv limited needs hire environmental officer got relevant experience could good share someone might need details environmental office,,"hiring,jobs,XDeputy",0,0,0,0,18,0.4939,positive,1
2025-06-28 17:25:13,KAMITH2010,register virtual hiring orientation monday ages ages free employment program join,,"Hiring,Jobs,JobTraining,Employment",0,0,0,0,2,0.6705,positive,2
2025-06-28 17:16:48,CvsAndResumes,still wondering demand jobs worldwide find blog bonus give refresh,LinkedIn,"2,1,resume,coverlettrr,JobSearch,Layoffs,Recession,Jobs,GetHired,Hiring",0,0,0,0,22,0.4588,positive,2
2025-06-28 17:16:04,SDBNJobs,specialist regulatory strategy ech jobs specialist regulatory strategy,,"biotech,jobs",0,0,0,0,28,0.0,neutral,3
2025-06-28 17:15:46,CvsAndResumes,still wondering demand jobs worldwide find blog bonus give refresh,LinkedIn,"2,1,resume,coverlettrr,JobSearch,Layoffs,Recession,Jobs,GetHired,Hiring",0,0,0,0,22,0.4588,positive,2
2025-06-28 17:15:06,MMGLandRover,vehicle progressor required marshall drive career forward join us find apply online see cruitment wrd run etrec gf open wvid gxk lang usa vacancy id gxju,,"LandRover,Swindon,jobs",1,0,0,0,45,0.296,positive,2
2025-06-28 17:14:32,SCOUTERworks,let us save time scout capable competent efficient freelancers job focus matters handle search experience fast delivery trusted results budget friendly dm get jobs done,,"scout,jobs,Entrepreneur",2,2,0,0,152,0.9493,positive,2
2025-06-28 17:13:07,MrsKunziToBe,never heard back job applied back filled get thu two open day happened fix,AUTONation,"UX,ProductDesigner,JAN2025,LETTER,JUNE27,ReAPPLY,Jobs,MACYs,PEDO,PrinceWILLIAM,UK,FL",0,0,0,0,21,0.0,neutral,2
2025-06-28 17:12:32,FreshGulfJob,abs group careers american bureau shipping jobs uae usa uk apply link,,"jobs,careers,jobvacancy,jobs2025,hiring,freshgulfjob,recruitment,jobvacancy2025,uaejobs,ShippingJobs",0,0,0,0,57,0.0,neutral,2
2025-06-28 17:11:48,muhwezipauljohn,everything meed,huitongbuilding,"Jobs,jobs,Jobs,Jobs,Huitongbuildingmaterials",2,1,0,0,18,0.0,neutral,2
2025-06-28 16:46:14,orbit_careers,leave last job sample answers ave last job utm source reviveoldpost utm medium social utm campaign reviveoldpost,,"Jobsearch,Jobs,Job,InterviewTips,Career",0,0,0,0,9,-0.0516,negative,3
2025-06-28 16:45:15,Transform_Sec,pressure mounting cut favor,"CSOonline,JLeyden","jobs,AI,tech,cybersecurity,business,leadership,management,layoffs,CISO,CIO,CTO,CEO,skills,talent,talentmanagement",2,0,0,0,52,-0.1531,negative,2
2025-06-28 16:40:07,NavalNuclearLab,naval nuclear laboratory offers wide range opportunities personal professional development opportunities like education assistance leadership programs grow career apply,,"BestTeamMates,jobs",0,0,0,0,11,0.7717,positive,2
2025-06-28 16:34:07,Javascriptjobbs,hiring solventum senior software engineer location remote united states job ayvmutnevlos senior software engineer solventum utm medium social,,"javascript,reactjs,nodejs,vuejs,jobs,hiring",0,0,0,0,105,0.4215,positive,4
2025-06-28 16:34:04,MWBionetworks,mwbn jobs therapeutic area specialist tas neuroscience cobenfy farmington hills mi farmington hills mi cience jobs therapeutic area specialist tas neuroscience cobenfy farmington hills mi farmington hills mi utm source rss utm medium rss utm campaign therapeutic area specialist tas neuroscience cobenfy farmington hills mi farmington hills mi,,"biotech,jobs",0,0,0,0,16,0.0,neutral,3
2025-06-28 16:33:13,jorgesette7,ten reasons rise globally reasons portuguese foreign language rise globally via,jorgesetteELT,"Portuguese,ForeignLanguage,LearnPortuguese,onlinelessons,Jobs",0,1,0,0,6,0.0,neutral,2
2025-06-28 16:32:36,UnlistedJobs,unlisted job alert role devops architect location united states salary skills devops docker python scala azure kubernetes grafana jenkins prometheus terraform employees,,"remote,jobs",0,0,0,0,25,0.6124,positive,4
2025-06-28 16:26:43,bittalentglobal,walmart inc hiring usa principal ux designer data experiences anywhere year work home full time apply,,"jobs,unemployment,JobSeekersSA,bittalent,ad",0,0,0,0,130,0.0,neutral,0
2025-06-28 16:26:42,bittalentglobal,freeup hiring remote ux designer anywhere work home contractor degree mentioned apply,,"jobs,unemployment,JobSeekersSA,bittalent,ad",0,0,0,0,20,0.0,neutral,0
2025-06-28 16:26:42,bittalentglobal,chocohouse ragusa hiring new position ui ux designer remote intern anywhere days ago work home internship apply,,"jobs,unemployment,JobSeekersSA,bittalent,ad",0,0,0,0,64,0.0,neutral,0
2025-06-28 16:24:00,IHBCtweet,reminder bromsgrove district council redditch borough council conservation officer full time permanent closes,,"conservation,heritage,jobs,localgovernment",0,0,0,0,136,0.0,neutral,4
2025-06-28 16:19:13,softwarecontent,link bio follow job updates,softwarecontent,"software,softwarecompany,softwarestack,softwarejobs,Jobs",0,0,0,0,5,0.0,neutral,2
2025-06-28 16:17:28,Hiring_Nevada,power platform application developer power platform application developer job posting form application developer,,"ITJobs,Techjobs,hiring,techjobs,HiringNow,jobs,hiring,job",0,0,0,0,19,0.0,neutral,0
2025-06-28 16:16:00,purposeworks_,want miss person meeting monday great morning planned networking recruiter insights free headshots join us,,"purposeworks,purposeseeker,jobseeker,jobsearch,networking,headshots",0,0,0,0,5,0.8519,positive,0
2025-06-28 16:15:05,dailyfinancial7,mastering work life balance secrets establishing boundaries managers day one life balance secrets establishing boundaries managers day one,,"working,CorporateLife,Jobs",0,0,0,0,11,0.0,neutral,2
2025-06-28 16:14:13,UPacificCareers,fuel career one fuel convenience stores hiring dana point ca click learn,,"careersinretail,jobsinretail,jobs,job",0,0,0,0,10,0.0,neutral,2
2025-06-28 16:12:06,shiftdimension1,,,"career,jobs,recruitment,business,leadership,commercial,growth",0,0,0,0,4,0.0,neutral,2
2025-06-28 16:09:19,UPacificCareers,goes better sales associate position apply,,"roadtrips,snacks,jobs,retailjobs",0,0,0,0,3,0.4404,positive,0
2025-06-28 16:07:05,Javascriptjobbs,hiring blumira senior front end engineer location remote united states jobqrou farimulb senior front end engineer blumira utm medium social,,"javascript,reactjs,nodejs,vuejs,jobs,hiring",0,0,0,0,99,0.4215,positive,4
2025-06-28 16:04:04,MWBionetworks,mwbn jobs crm product specialist empower pacemaker north central detroit mi cience jobs crm product specialist empower pacemaker north central detroit mi utm source rss utm medium rss utm campaign crm product specialist empower pacemaker north central detroit mi,,"biotech,jobs",0,0,0,0,4,0.0,neutral,3
2025-06-28 16:03:00,wlpjobs,stripe hiring design engineer presence expansion london,,"designengineer,productjobs,jobs",1,1,0,0,60,0.0,neutral,4
2025-06-28 16:02:00,wlpjobs,godaddy hiring senior ux designer colombia,,"uxdesigner,productjobs,jobs",0,0,0,0,54,0.0,neutral,4
2025-06-28 16:01:00,wlpjobs,godaddy hiring vice president product management independents kirkland,,"productmanager,productjobs,jobs",0,0,0,0,45,0.0,neutral,4
2025-06-28 16:00:35,Jehlumjk,centre development advanced computing cdac recruitment advt notification corp gr,,"Jehlum,Jobs",1,0,0,0,19,0.25,positive,4
2025-06-28 15:59:00,wlpjobs,robinhood hiring director design crypto bellevue,,"designdirector,productjobs,jobs",0,0,0,0,34,0.0,neutral,4
2025-06-28 15:58:00,wlpjobs,robinhood hiring senior manager product management crypto menlo park,,"productmanager,productjobs,jobs",0,0,0,0,55,0.0,neutral,4
2025-06-28 15:57:00,wlpjobs,peloton hiring product manager hardware new york,,"productmanager,productjobs,jobs",0,0,0,0,57,0.0,neutral,4
2025-06-28 15:56:04,WOBionetworks,wobn jobs sponsored research coordinator seattle wa gon biotech jobs sponsored research coordinator seattle wa utm source rss utm medium rss utm campaign sponsored research coordinator seattle wa,,"biotech,jobs",0,0,0,0,20,0.0,neutral,3
2025-06-28 15:56:00,wlpjobs,figma hiring product manager ai remote us,,"productmanager,productjobs,jobs,remotejobs",0,0,0,0,54,0.0,neutral,4
2025-06-28 15:55:00,wlpjobs,gofundme hiring senior data product manager remote,,"productmanager,productjobs,jobs,remotejobs",0,0,0,0,54,0.0,neutral,4
2025-06-28 15:54:54,JoshoJpatterson,edtech jobs list looking job edtech companies listed google doc hiring post new lists every week bluesky instagram days also share jobs linkedin,,"406,Jobs,hiring,EducationJobs",1,0,0,0,99,0.296,positive,3
2025-06-28 15:54:16,jobs_jobringer,remote hybrid global jobringer makes happen,,"jobringer,globalhiring,hiresmarter,Futures,Jobs,hiring",2,0,0,0,15,0.0,neutral,4
2025-06-28 15:54:00,wlpjobs,mutiny hiring product manager new york,,"productmanager,productjobs,jobs",0,0,0,0,41,0.0,neutral,4
2025-06-28 15:53:00,wlpjobs,databricks hiring sr product manager technical san francisco,,"productmanager,productjobs,jobs",0,0,0,0,67,0.0,neutral,4
2025-06-28 15:52:00,wlpjobs,databricks hiring sr director application product management gtm customer support mountain view,,"productmanager,productjobs,jobs",0,0,0,0,52,0.4019,positive,4
2025-06-28 15:40:12,JCPSurreySussex,plenty different roles housekeeper zookeeper chessington world adventures hiring info,CWOA,"ThemeParks,Chessington,Surrey,Jobs",1,0,0,0,90,0.34,positive,0
2025-06-28 15:38:35,LokeshK94212949,ai replacing animators ai replacing animation jobs sparks industry debate,,"AI,Animation,Jobs,TechImpact,Entertainment",0,0,0,0,15,0.0,neutral,4
2025-06-28 15:38:32,ITLouisiana,rd line support engineer rd line support engineer job posting upport engineer,,"ITJobs,Techjobs,hiring,ITSupportJobs,TechIndustry,NowHiring,RemoteITJobs,JobOpening,jobs",1,0,0,0,3,0.6597,positive,0
2025-06-28 15:38:26,Job_Energy,safe agile scrum master description largest provider services leidos develops sustains large data technology infrastructures integrates complex law scrum master,,"jobpostings,ITJobPro,jobs,NowHiring",0,0,0,0,9,0.4404,positive,1
2025-06-28 15:36:58,HrAhmedabad,free jobs freshers exp candidates place india hr consultancy providing free job placement assistance services changodar naroda gidc odhav kathwada vatva kuha bakrol pirana sanand,,"Ahmedabad,Place1india,jobconsultancy,jobs,vacancy,hiring,PlacementAssistance",0,0,0,0,7,0.765,positive,2
2025-06-28 15:34:36,PantherStaff,looking better job search experience work panther recruiters good hands apply today vr utm medium twitter,,"JobSearch,Application,Career,Hiring,Jobs",0,0,0,0,10,0.7003,positive,0
2025-06-28 15:34:09,Javascriptjobbs,hiring timmons group senior gis software engineer front end location remote united states jobwx snommit senior gis software engineer front end timmons group utm medium social,,"javascript,reactjs,nodejs,vuejs,jobs,hiring",0,0,0,0,110,0.4215,positive,4
2025-06-28 15:33:37,Oruvajobs,,,"educationalcontent,jobseekingtips,oruvajobs,Digital,digitaldesign,career,jobs,cvdesign,ResumeTips",0,0,0,0,3,0.0,neutral,2
2025-06-28 15:12:04,TXBionetworks,txbn jobs director cell gene therapy irving tx jobs director cell gene therapy irving tx utm source rss utm medium rss utm campaign director cell gene therapy irving tx,,"biotech,jobs",0,0,0,0,12,0.7579,positive,3
2025-06-28 15:02:48,upbasicedu391,lt grade lecturer recruitment update upbasicedu livejournal source twsharing utm medium social via,livejournal,"UPPSC,Exam,Job,vacancy,UPNews,viral,upboard,holiday,India,School,teacher",0,0,0,0,19,0.0,neutral,3
2025-06-28 15:00:50,Jehlumjk,national institute disaster management nidm consultant recruitment advt notification,,"Jehlum,Jobs",1,0,0,0,18,-0.6249,negative,2
2025-06-28 15:00:41,uiuxjobsboard,full time design position senior ux ui designer needed soda remote united states build products users love apply today mote united states senior ux ui designer,,"design,ux,jobs,tech",0,0,0,0,50,0.8689,positive,4
2025-06-28 15:00:30,JCPBedsAndHerts,hertfordshire sports village recruiting casual climbing instructors de havilland campus hatfield herts info apply,,"SportsJobs,LeisureJobs,Jobs,Hatfield,Herts",0,0,0,0,47,0.2023,positive,0
2025-06-28 15:00:21,Javascriptjobbs,hiring hubspot senior software engineer frontend location remote united states jobkojkzdtopsbuh senior software engineer frontend hubspot utm medium social,,"javascript,reactjs,nodejs,vuejs,jobs,hiring",0,0,0,0,140,0.4215,positive,4
2025-06-28 14:56:04,WOBionetworks,wobn jobs medical science liaison gon biotech jobs medical science liaison utm source rss utm medium rss utm campaign medical science liaison,,"biotech,jobs",0,0,0,0,14,0.0,neutral,3
2025-06-28 14:52:04,GILEJoBs_SA,apply waterberg tvet college etdp seta internships details please visit erberg tvet college graduate internships hurry deadline th june exciting jobs visit,,"Jobs,Job,JobSeekersSA,NamtanFilm,SquidGame3",0,0,0,0,37,0.6705,positive,2
2025-06-28 14:23:42,SAICjobs,know anyone might looking work suffolk va share job,,"SAIC,Jobs,JobPosting",0,0,0,0,15,0.296,positive,1
2025-06-28 14:23:02,arbeitnow,looking work python backend engineer,,"Engineering,Remote,Experienced,fulltimepermanent,Germany,hiring,jobs",0,0,1,0,57,0.0,neutral,0
2025-06-28 14:20:03,bankofbiology,pet animal life click read english tml,,"pets,petcare,petlovers,animals,animallover,birds,birdlovers,ias,upsc,generalknowledge,jobs",0,0,0,0,12,0.0,neutral,2
2025-06-28 14:16:03,SDBNJobs,qc chemist san diego ca ech jobs qc chemist san diego ca,,"jobs,biotech",0,0,0,0,39,0.0,neutral,3
2025-06-28 14:12:16,TheMeck,gives lesson basic economics democratic always talk needing redistribute wealth well going wealth redistribute everybody leaves develops wealth creates,KatiePavlich,"Dems,socialists,jobs",1,0,0,0,20,0.9153,positive,2
2025-06-28 14:12:04,TXBionetworks,txbn jobs data scientist biostatistics dallas fort worth tx jobs data scientist biostatistics dallas fort worth tx utm source rss utm medium rss utm campaign data scientist biostatistics dallas fort worth tx,,"biotech,jobs",0,0,0,0,9,0.8807,positive,3
2025-06-28 14:06:43,TennisOddyssey,colgate university head women coach apply,,"college,tennis,jobs,jobmarket,sportsjobs,Hamilton,NewYork",0,0,0,0,573,0.0,neutral,2
2025-06-28 14:05:08,Javascriptjobbs,hiring dioptra founding engineer fullstack location remote worldwide jobscpkxwartpoid founding engineer fullstack dioptra utm medium social,,"javascript,reactjs,nodejs,vuejs,jobs,hiring",0,0,0,0,107,0.0,neutral,4
2025-06-28 14:04:45,sci_career,laboratory referral specialist ii bethesda maryland rochester minnesota united states,,"science,career,jobs,job,jobsearch",0,0,0,0,17,0.4215,positive,4
2025-06-28 14:04:30,sci_career,laboratory referral specialist ii bethesda md rochester minnesota united states,,"science,career,jobs,job,jobsearch",0,0,0,0,9,0.4215,positive,4
2025-06-28 14:02:44,sci_career,industry engagement administrator fixed term years,,"science,career,jobs,job,jobsearch",0,0,0,0,8,0.4588,positive,0
2025-06-28 14:02:28,sci_career,isaac newton trust sir john plumb academic career development fellowship latin american history fixed term,,"science,career,jobs,job,jobsearch",0,0,0,0,8,0.5106,positive,2
2025-06-28 14:02:13,sci_career,recruitment hr staff hub coordinator internal applicants,,"science,career,jobs,job,jobsearch",0,0,0,0,10,0.0,neutral,2
2025-06-28 14:01:58,sci_career,research administrator part time fixed term,,"science,career,jobs,job,jobsearch",0,0,0,0,5,0.0,neutral,0
2025-06-28 14:01:43,sci_career,phd position investigating intracellular metalloproteases macrophage mediated inflammation,,"science,career,jobs,job,jobsearch",0,0,0,0,19,0.0,neutral,0
2025-06-28 14:01:28,sci_career,phd position ai based grid capacity optimization using battery energy storage systems bess,,"science,career,jobs,job,jobsearch",0,0,0,0,23,0.5719,positive,4
2025-06-28 14:01:12,sci_career,business analyst rochester minnesota united states,,"science,career,jobs,job,jobsearch",0,0,0,0,10,0.4215,positive,4
2025-06-28 14:00:57,sci_career,post doctoral research positions high energy astrophysics,,"science,career,jobs,job,jobsearch",0,0,0,0,10,0.2732,positive,3
2025-06-28 14:00:57,PSEGCareers,tackle challenges make difference pseg continuous improvement prj ldr newark nj help keep nj running smoothly,,"NowHiring,ProblemSolver,PSEGJobs,PSEGJobs,Jobs",0,0,0,0,47,0.7184,positive,2
2025-06-28 14:00:45,Jehlumjk,national capital region transport corporation ltd ncrtc recruitment advt notification,,"Jehlum,Jobs",1,0,0,0,25,0.0,neutral,2
2025-06-28 14:00:42,sci_career,records manager,,"science,career,jobs,job,jobsearch",0,0,0,0,8,0.0,neutral,0
2025-06-28 14:00:37,NYSHCR,hcr hiring offer competitive pay comprehensive benefits package including paid leave health dental vision retirement family friendly policies apply,,"HCR,Jobs",0,0,0,0,47,0.836,positive,0
2025-06-28 13:40:13,KaneJobs,job bucks county pa info link,,"hiring,accountant,accountant,cpa,jobs",0,0,0,0,10,0.0,neutral,2
2025-06-28 13:37:01,golangprojects,follow us bluesky make sure miss latest projects com,,"golang,jobs",0,0,0,0,288,0.1779,positive,2
2025-06-28 13:35:04,engineering_hr,post doctoral research positions high energy astrophysics,,"engineering,career,jobs,job,jobsearch",0,0,0,0,11,0.2732,positive,3
2025-06-28 13:35:02,deepblu,screwing workers giving,,"Walmart,American,jobs,Indian,H1B,Visas",2,1,2,0,94,0.128,positive,2
2025-06-28 13:34:34,engineering_hr,senior application developer,,"engineering,career,jobs,job,jobsearch",0,0,0,0,9,0.0,neutral,0
2025-06-28 13:34:33,bethania______,ah reading ah something like reach steve dream,,"Jobs,ICanDo",0,0,1,0,17,0.5574,positive,2
2025-06-28 13:34:19,engineering_hr,software business developer technical writer,,"engineering,career,jobs,job,jobsearch",0,0,0,0,15,0.0,neutral,0
2025-06-28 13:32:02,engineering_hr,laboratorieingenj inom ai,,"engineering,career,jobs,job,jobsearch",0,0,0,0,8,0.0,neutral,4
2025-06-28 13:31:47,engineering_hr,software engineer high energy astrophysics,,"engineering,career,jobs,job,jobsearch",0,0,0,0,11,0.2732,positive,0
2025-06-28 13:31:31,engineering_hr,software engineer high energy astrophysics,,"engineering,career,jobs,job,jobsearch",0,0,0,0,13,0.2732,positive,0
2025-06-28 13:31:17,Jehlumjk,maulana azad national institute technology manit non teaching position recruitment advt notification rectt nfr,,"Jehlum,Jobs",1,0,0,0,17,0.0,neutral,2
2025-06-28 13:31:16,engineering_hr,bachelor master thesis development heating network simulation tool topology based model creation interface,,"engineering,career,jobs,job,jobsearch",0,0,0,0,10,0.2732,positive,4
2025-06-28 13:30:00,NCSIndia,crack next interview ncs resumes group discussions got covered register get started,,"NCS,Career,Skills,Jobs,Employment",8,4,0,0,714,0.0,neutral,2
2025-06-28 13:27:41,illbeback_jobs,hpc ai sc presales specialist uk hewlett packard enterprise presales specialist uk feed id unique id fedccecec follow updated new,HPE,"jobs,AI,ML,AIJobs,AITalent,hiring,MachineLearning,London",0,0,0,0,35,0.0,neutral,4
2025-06-28 13:23:31,NicholasIjasini,praying help day retweet helper could timeline firstclass graduate modibbo adama university yola second frame adamawa civil service commission application slip,"followADSG,atiku,NuhuRibadu,AdamawaLas79384,Adamawa_Gov","jobseeker,helpinghand",1,1,0,0,68,0.765,positive,2
2025-06-28 13:14:23,ITjobsMontana,senior desktop support technician description ngen largest services program navy service management ktop support technician,,"ITJobs,JobOpening,jobs,techjobs,ITSupportJobs,jobpostings,hiring",0,0,0,0,8,0.6597,positive,0
2025-06-28 13:12:04,TXBionetworks,txbn jobs imaging field applications scientist jobs imaging field applications scientist utm source rss utm medium rss utm campaign imaging field applications scientist,,"biotech,jobs",0,0,0,0,6,0.0,neutral,3
2025-06-28 13:08:24,ITMissouri,staff software engineer cloud always world believe essential genuine connection work ruckus ware engineer cloud,,"hiringnow,softwarejobs,TechJob,ITjobs,TechJobs,jobs",0,0,0,0,5,0.0,neutral,4
2025-06-28 13:05:31,Jobs_IT_USA,air force operational energy data analyst description leidos seeking air force data analyst support operational energy office deputy assistant operational energy data analyst,,"jobsearch,jobs,hiring",0,0,0,0,24,0.7906,positive,1
2025-06-28 13:05:04,lpamanian,apply,,"Jobfair,USPSCareers,Virginiajobs,hiring,jobs,jobsearch,applynow,joinourteam,USPS,USPSEmployee,USPSEmployee",1,0,0,0,22,0.0,neutral,2
2025-06-28 13:05:00,DuPageCountyCS,hiring find next career dupage county community services join team available positions found co,,"Hiring,Jobs,DuPageCounty,CommunityServices",0,0,0,0,37,0.296,positive,2
2025-06-28 13:01:08,ChichesterDC,job opportunity currently looking facilities supervisor join fantastic facilities team deadline apply friday july information apply please visit ies chff,,"ExceptionalPeopleDoingExtraordinaryJobs,Jobs",0,0,1,0,102,0.872,positive,2
2025-06-28 12:50:50,247JobzInCanada,explore wrha careers find rewarding healthcare jobs winnipeg apply nursing admin allied health positions across manitoba details visit,,"jobs,jobsincanada,healthcarejobs",0,0,0,0,11,0.5267,positive,2
2025-06-28 12:50:14,CaremarkRedcar,angela edwards,,"homecare,awards,celebrating,staff,customers,jobs,careers,TeamBlue",0,0,0,0,5,0.0,neutral,2
2025-06-28 12:50:09,Recruitment_EMC,,,",,,,,,,,English,Mathematics,Science,,,Recruitment,school,jobs,saudi,travel,teacher,saudi,accounting,housekeeping,employment,emergencyncy,flight",0,0,0,0,64,0.0,neutral,2
2025-06-28 12:47:29,TN_IT_Jobs,data center delivery technical infrastructure program manager job posting delivery technical infrastructure program manager one intake program team,,"RemoteITJobs,TechJobs,TechIndustry,jobs,career",0,0,0,0,4,0.0,neutral,2
2025-06-28 12:47:26,ITJobs_AL,quality assurance associate dedicated associates conduent delivers mission critical services solutions behalf fortune surance associate,,"RemoteDeveloper,ProgrammingJobs,jobalert,ITCareers,jobs",0,0,0,0,4,0.5859,positive,0
2025-06-28 12:47:18,ClickForSEO_GB,week featured writing jobs newsletter june th joined slack group ingjobs weeks featured writing jobs utm campaign post utm medium web showwelcomeonshare true,,"remotejobalert,Jobs,writerscommunity",0,0,0,0,5,0.4215,positive,3
2025-06-28 12:43:01,latestly,elon musk responds question jobs cannot automated ai says premium human experiences,elonmusk,"ElonMusk,Jobs,AI,JobsLoss,artificialintelligence,Layoffs",0,0,2,0,67,0.0,neutral,4
2025-06-28 12:41:11,ndtveducation,registration begins technician posts indian railways check details rnment jobs rrb technician application registration begins posts heres direct link apply rrbapply gov,,jobs,0,0,0,0,65,0.0,neutral,2
2025-06-28 12:27:32,iamreubenask,tesla launched robotaxis austin million transportation workers watching nervously self driving cars biggest job displacement modern history,,"TeslaRobotaxi,AutonomousVehicles,TechDisruption,AI,Transportation,Jobs",1,0,1,0,98,-0.0258,neutral,2
2025-06-28 12:27:00,NCSIndia,looking work home jobs register ncs portal apply thousands job openings,,"NCS,Career,Skills,Jobs,Employment,Workfromhome",5,5,0,0,647,0.0,neutral,2
2025-06-28 12:26:52,247JobzInCanada,explore manitoba hydro careers rewarding job opportunities energy find engineering tech utility jobs across manitoba apply details visit,,"jobs,jobsincanada,GovernmentJobs",0,0,0,0,8,0.7964,positive,2
2025-06-28 12:26:32,IllinoisRecruit,quality assurance associate dedicated associates conduent delivers mission critical services surance associate,,"RemoteITJobs,ITJobs,DeveloperJobs,TechnologyJobs,jobsearch,jobs,hiring,DevOpsJobs",0,0,0,0,10,0.4767,positive,0
2025-06-28 12:23:25,hire_Kentucky,peoplesoft financial techno functional developer description looking opportunity make financial techno functional developer,,"JobOpening,job,Recruiting,TechJobs,jobs,RemoteITJobs,jobsite,ProgrammingJobs",0,0,0,0,37,0.4215,positive,0
2025-06-28 12:23:02,arbeitnow,impossible cloud hiring senior recruiter,,"People,Fulltime,Germany,hiring,jobs",0,0,0,0,28,0.0,neutral,4
2025-06-28 12:13:46,bittalentglobal,evetech pty ltd hiring junior customer support representative centurion south africa days ago full time degree mentioned apply,,"jobs,unemployment,JobSeekersSA,bittalent,ad",0,0,0,0,13,0.4019,positive,0
2025-06-28 12:13:46,bittalentglobal,south african telecoms hiring telecommunications junior customer support specialist western cape south africa days ago full time degree mentioned apply,,"jobs,unemployment,JobSeekersSA,bittalent,ad",0,0,0,0,18,0.4019,positive,2
2025-06-28 12:13:46,bittalentglobal,planner hiring junior customer support agent remote anywhere work home contractor degree mentioned apply,,"jobs,unemployment,JobSeekersSA,bittalent,ad",2,0,0,0,47,0.4019,positive,0
2025-06-28 12:12:04,TXBionetworks,txbn jobs research investigator translational molecular pathology houston tx jobs research investigator translational molecular pathology houston tx utm source rss utm medium rss utm campaign research investigator translational molecular pathology houston tx,,"biotech,jobs",0,0,0,0,22,0.7579,positive,3
2025-06-28 12:09:35,LatinosHigherEd,new job alert maintenance worker bakersfield california,,"career,jobs",0,0,0,0,19,0.296,positive,4
2025-06-28 12:09:12,247JobzInCanada,explore top cn rail jobs canada find railway careers conductor roles job openings canadian national railway apply cn rail careers details visit,,"jobs,jobsincanada,GovernmentJobs",0,0,0,0,21,0.2023,positive,2
