timestamp,username,tweet,mentions,hashtags,likes,retweets,comments,replies,views,compound,sentiment,topic
2025-06-28 06:20:23,IT_Jobs_Ca,air force operational energy data analyst description leidos seeking air force data analyst support operational energy office deputy assistant operational energy data analyst,,"jobs,ITCareers,ITJobs,Tech",0,0,0,0,4,0.7906,positive,1
2025-06-28 06:15:59,j18yadav,day hr min cp applied hunched assignment shared recruiter feel like days go,,"VACATIONS,GRIND,Gym,DSA,Jobs",5,0,0,0,69,0.5994,positive,2
2025-06-28 06:13:00,JobclinicUg,temporary job vacancies alight recruiting procurement support staff months salary per day details support staff positions deadline june,,"JobsinUganda,Jobs,ApplyNow,Careers",4,0,0,0,870,0.6597,positive,2
2025-06-28 06:04:03,MWBionetworks,mwbn jobs validation project manager st louis mo cience jobs validation project manager st louis mo utm source rss utm medium rss utm campaign validation project manager st louis mo,,"biotech,jobs",0,0,0,0,7,0.0,neutral,3
2025-06-28 05:52:36,progjobboard,principal engineer leader artificial intelligence binance remote engineer leader artificial intelligence,,"programmingjobs,hiring,jobs,techjobs,developers,programming,devjobs,recruiter,recruiting",0,0,0,0,8,0.7351,positive,4
2025-06-28 05:42:28,zubinsomervell,credit score impact career clean credit history important ervell cibil financialdiscipline credithistory activity adgt could add data point job applicant data,"Naukri,Linkedin,TransUnion,TheOfficialSBI,ICICIBank,HDFC_Bank","India,CIBIL,Bank,Jobs",0,0,0,0,22,0.8271,positive,1
2025-06-28 05:34:56,UnlistedJobs,unlisted job alert role sales engineer channel location united states salary skills artificial intelligence scala aws azure microsoft employees,,"remote,jobs",0,0,0,0,25,0.7964,positive,4
2025-06-28 05:34:03,MWBionetworks,mwbn jobs cqv risk based approach expert st louis mo cience jobs cqv risk based approach expert st louis mo utm source rss utm medium rss utm campaign cqv risk based approach expert st louis mo,,"biotech,jobs",0,0,0,0,12,-0.6486,negative,3
2025-06-28 05:31:12,Jehlumjk,high court jammu kashmir ladakh srinagar drivers recruitment advt notification psy,,"Jehlum,Jobs",1,0,0,0,32,0.0,neutral,2
2025-06-28 05:30:05,sresthab,yr investment roadmap highlights opportunities alongside action,"dskushwah_singh,Girbane,apoorvapalkar,connectMSPGCL,TeamWCL,CoalIndiaHQ,TataPower,avaadagroup,TheJSWGroup,sidbiofficial,TheOfficialSBI","greengrowth,jobs,justtransition,climatechange",1,0,0,0,21,0.3818,positive,2
2025-06-28 05:30:00,healthspajobs,looking job thousands openings available upload resume get connected us website,,"healthspajobs,spa,spajobs,jobopportunity,jobopening,manager,Receptionist,therapist,beautician,housekeeping,jobs,jobsearch,jobseekers",2,0,0,0,23,0.0,neutral,2
2025-06-28 05:03:34,JobclinicUg,career vacancy ncba bank hiring assistant relationship manager personal banking details relationship manager personal banking deadline july,,"JobsinUganda,Jobs,ApplyNow",9,1,0,0,1119,0.0,neutral,2
2025-06-28 05:02:45,ThomaMore,france top earners mainly managers executives showing industry consistency roles offer annually highlighting select high paying opportunities jobs salaries mark limited,,"France,Jobs,SalaryStatistics",0,0,0,0,8,0.3612,positive,2
2025-06-28 05:00:22,uiuxjobsboard,design role open product designer supernova technology chicago il united states full time join team innovative creators learn oduct designer chicago il united states,,"uxdesign,careers,tech,jobs",0,0,0,0,31,0.8658,positive,4
2025-06-28 04:59:21,huang97961,usa job offer earn per week remote work home start today,,"usajobs,jobs,usa,jobsearch,hiring",0,0,0,0,11,0.0,neutral,0
2025-06-28 04:53:27,Vegas_IT_Job,lead cybersecurity software engineer lead cybersecurity software engineer focused full stack development security tools security software engineer,,"techjobs,JobOpening,jobs,HiringNow,ITJobs,jobpostings",0,0,0,0,6,0.7506,positive,4
2025-06-28 04:50:37,Gotogulfjobs,ac technician first step properties llc dubai united arab emirates scription aspx job id,,"gotogulf,jobs,middleeast,jobseeker,recruitment",1,0,0,0,42,0.4215,positive,2
2025-06-28 04:50:32,Gotogulfjobs,head finance snaphunt pte ltd dubai united arab emirates scription aspx job id,,"gotogulf,jobs,middleeast,jobseeker,recruitment",0,0,0,0,36,0.4215,positive,2
2025-06-28 04:44:57,GotoGulf,head finance snaphunt pte ltd dubai united arab emirates scription aspx job id,,"gotogulf,jobs,middleeast,jobseeker,recruitment",0,0,0,0,46,0.4215,positive,2
2025-06-28 04:44:41,GotoGulf,ac technician first step properties llc dubai united arab emirates scription aspx job id,,"gotogulf,jobs,middleeast,jobseeker,recruitment",0,0,0,0,44,0.4215,positive,2
2025-06-28 04:44:25,GotoGulf,team leader real estate first step properties llc dubai united arab emirates scription aspx job id,,"gotogulf,jobs,middleeast,jobseeker,recruitment",0,0,0,0,40,0.4215,positive,2
2025-06-28 04:44:09,GotoGulf,ne draftsman al habib trading contracting company saudi arabia scription aspx job id,,"gotogulf,jobs,middleeast,jobseeker,recruitment",0,0,0,0,30,0.0,neutral,2
2025-06-28 04:38:20,MamboJournal,sierra leone sets sights becoming west africa new oil gas frontier turns economy increase streams hence citizenry ets sights becoming west africas new oil gas frontier,,"SierraLeone,oil,gas,diversify,mining,agriculture,renenue,attract,FDI,creating,jobs",0,0,0,0,42,0.3182,positive,4
2025-06-28 04:35:24,Hiring_Nevada,lead cybersecurity software engineer lead cybersecurity software engineer focused full stack development security tools enable engineering teams security software engineer,,"jobpostings,jobs,hiring,JobOpening",1,0,0,0,28,0.7506,positive,4
2025-06-28 04:34:03,MWBionetworks,mwbn jobs senior lab associate biology college arts sciences cincinnati oh cience jobs senior lab associate biology college arts sciences cincinnati oh utm source rss utm medium rss utm campaign senior lab associate biology college arts sciences cincinnati oh,,"biotech,jobs",0,0,0,0,13,0.0,neutral,3
2025-06-28 04:31:34,UnlistedJobs,unlisted job alert role front end developer location united states salary skills net docker postgresql typescript javascript react scala html sql jquery employees,,"remote,jobs",0,0,0,0,69,0.6124,positive,4
2025-06-28 04:31:03,SFBNJobs,research associate senior research associate san francisco ca biotech jobs research associate senior research associate san francisco ca,,"jobs,biotech",0,0,0,0,26,0.0,neutral,3
2025-06-28 04:30:11,IndiaSmartGridF,isgf invites applications position manager technical interested eligible candidates please send resume careers org read details,"indiasmartgrid,rjeipillai,suri_reena","JobOpportunity,ISGFCareer,Career,Vacancy",0,0,0,0,21,0.6124,positive,2
2025-06-28 04:00:09,Emailjobsio,new job email lifecycle marketing manger unrivaled sports read lifecycle marketing manger unrivaled sports,,"emailmarketing,jobsearch,jobs,email,marketingautomation,emailjobs,marketingtwitter",0,0,0,0,19,0.0,neutral,4
2025-06-28 04:00:01,echojobs__io,oracle hiring software developer us,,"oracle,tech,softwareengineer,jobs",0,0,0,0,43,0.0,neutral,0
2025-06-28 04:00:01,ger_service,want everything need know qualifications demand help placement need know make germany,,"work,Germany,WorkInGermany,jobs,vocationaltraining",9,1,0,0,1907,0.3612,positive,1
2025-06-28 03:56:19,AgileUAE,new job opening hiring business development manager location sharjah salary aed industry shipping freight apply development manager,,"Hiring,Recruitment,Jobs,Careers,Sales,BusinessDevelopment,Shipping,Freight,Apply,AgileConsultants",0,0,0,0,25,0.0,neutral,0
2025-06-28 03:56:03,WOBionetworks,wobn jobs vaccine acct executive gon biotech jobs vaccine acct executive utm source rss utm medium rss utm campaign vaccine acct executive,,"biotech,jobs",0,0,0,0,36,0.0,neutral,3
2025-06-28 03:52:06,Jehlumjk,indian institute technology iit kharagpur professional trainee recruitment advt notification,,"Jehlum,Jobs",1,0,0,0,15,0.0,neutral,4
2025-06-28 03:48:48,21sparksacademy,safety recruitment,,"Jobs,Opportunity",1,0,0,0,386,0.4215,positive,2
2025-06-28 03:44:26,ITIowa,desktop support technician description ngen largest services program navy service pport technician,,"TechHiring,jobs,ITSupportJobs,jobpostings,InformationTechnology,TechnologyJobs,Recruiting",0,0,0,0,4,0.4019,positive,2
2025-06-28 03:42:50,Abhi1Royal,top updates worldwide india let connect date today yesterday,,"HR,Hiring,Learning,Development,HR,HumanResources,HRManagement,CHRO,CXO,TA,Talent,TalentManagement,Technology,AI,Recruitment,COO,Leadership,Acquisition,Jobs,Trending,Tech,TechNews",0,1,0,0,28,0.2023,positive,2
2025-06-28 03:15:51,AgileUAE,hiring logistics executive location dubai salary aed apply executive,,"Hiring,Recruitment,Networking,Careers,Jobs,Logistics,Manufacturing,Trading,ApplyNow,AgileConsultants",0,0,0,0,45,0.0,neutral,0
2025-06-28 03:08:24,ITKentucky,lead cybersecurity software engineer lead cybersecurity software engineer focused full stack development security tools enable security software engineer,,"job,RemoteTechJobs,jobs,ITCareers,jobsearch",0,0,0,0,8,0.7506,positive,4
2025-06-28 03:07:45,satishnagarajan,dated,,"vacancy,jobs",1,0,0,0,102,0.0,neutral,2
2025-06-28 02:57:19,CVwritingformat,mastercard hiring role java developer pune india stercard hiring role java developer pune india,mastercardindia,"Mastercard,Jobs",0,0,0,0,33,0.0,neutral,4
2025-06-28 02:56:03,WOBionetworks,wobn jobs specialty account manager gon biotech jobs specialty account manager utm source rss utm medium rss utm campaign specialty account manager,,"biotech,jobs",0,0,0,0,24,0.0,neutral,3
2025-06-28 02:38:00,UPacificCareers,got spark illuminating los angeles ca opportunities sales associate ignite career rocket,,"jobs,retailjobs",0,0,0,0,8,0.5423,positive,2
2025-06-28 02:35:54,UnlistedJobs,unlisted job alert role data analyst location united states salary skills artificial intelligence python azure sql pyspark markets central banking financial systems employees,,"remote,jobs",0,0,0,0,43,0.7964,positive,4
2025-06-28 02:32:14,Jkalertscom,skuast jammu fresh jobs recruitment read,,"SKUAST,Jammu,jobs,jkalerts",0,0,0,0,32,0.3182,positive,2
2025-06-28 02:31:12,Jehlumjk,indian institute technology kharagpur professional trainee recruitment advt notification,,"Jehlum,Jobs",2,0,0,0,22,0.0,neutral,4
2025-06-28 02:00:01,echojobs__io,wikimedia foundation hiring engineering manager,,"remote,wfh,kubernetes,tech,softwareengineer,jobs",0,0,0,0,31,0.0,neutral,4
2025-06-28 01:56:03,WOBionetworks,wobn jobs associate clinical specialist gon biotech jobs associate clinical specialist utm source rss utm medium rss utm campaign associate clinical specialist,,"biotech,jobs",0,0,0,0,25,0.0,neutral,3
2025-06-28 01:47:41,orbit_careers,leave last job sample answers ave last job utm source reviveoldpost utm medium social utm campaign reviveoldpost,,"Jobs,Jobsearch,Career,Job,InterviewTips",0,0,0,0,1,-0.0516,negative,3
2025-06-28 01:45:52,workus_org,recruiter bpo growth troops,,"jobs,job,Remoto,Brazil",0,0,0,0,4,0.3818,positive,2
2025-06-28 01:35:41,UnlistedJobs,unlisted job alert role solutions engineer location united states salary skills java javascript objective scala oauth markets coaching consumer content design employees,,"remote,jobs",0,0,0,0,36,0.6908,positive,4
2025-06-28 01:32:01,DiedreMoire,field mechanic automated food packaging toms river nj diedremoire,,"JobSearch,JobHunt,JobOpening,Hiring,Job,Jobs,Careers,Employment,jobposting,fieldservicejobs,technicianjobs",0,0,0,0,10,0.0,neutral,0
2025-06-28 01:28:22,marty_sain65936,dmux roizodwo yo loads dont wanna hear complaining git thur farm yer asses want ppl pickin loads ur side anything,,"MAGA,farm,jobs,black,blacksfortrump",0,0,0,0,8,0.2244,positive,0
2025-06-28 01:27:45,UPacificCareers,happened crustacean late work lobster job need job check sales associate position,,"LOL,SorryNotSorry,job,jobs",0,0,0,0,5,0.0,neutral,0
2025-06-28 01:19:59,AbsurdAIHumor,,,"ai,aiArt,aiArtWork,isotype,dataviz,diagram,employment,craftspeople,statistics,visualization,infographic,international,labor,jobs",1,0,1,0,53,0.0,neutral,2
2025-06-28 01:00:52,Jehlumjk,qul fruits kashmir procurement executive job vacancy,,"Jehlum,Jobs",1,0,0,0,22,0.0,neutral,2
2025-06-28 01:00:08,Emailjobsio,new job growth marketing manager lifecycle lyft read rketing manager lifecycle lyft,,"emailmarketing,jobsearch,jobs,email,marketingautomation,emailjobs,marketingtwitter",0,0,0,0,16,0.3818,positive,4
2025-06-28 00:59:30,Job_driving,sr security systems engineer dce security solutions engineering sr security systems engineer dce systems engineer dce security solutions engineering,,"DeveloperJobs,TechCareers,Recruiting,ITCareers,jobs,jobpostings,job",0,0,0,0,8,0.875,positive,4
2025-06-28 00:59:23,ITjobsMontana,air force operational energy data analyst description leidos seeking air force data analyst support operational energy operational energy data analyst,,"TechIndustry,HiringNow,ITCareers,jobs,job,ITSupportJobs",0,0,0,0,7,0.7906,positive,1
2025-06-28 00:56:02,WOBionetworks,wobn jobs research scientist engr seattle wa gon biotech jobs research scientist engr seattle wa utm source rss utm medium rss utm campaign research scientist engr seattle wa,,"biotech,jobs",0,0,0,0,42,0.0,neutral,3
2025-06-28 00:50:01,DanCostellodeux,wollongong yr uow mib mo global leadership uow st impact th qs liberals burn grads wins graduated top cohort months early master international business,,"Jobs,CareerChange",0,0,0,0,11,0.6705,positive,2
2025-06-28 00:36:24,UPacificCareers,scientists trust atoms anymore make everything job offers job location real check,,"job,jobs",0,0,0,0,3,0.5106,positive,2
2025-06-28 00:33:57,UnlistedJobs,unlisted job alert role ai solutions engineer location united states salary skills artificial intelligence analytics machine learning open source employees,,"remote,jobs",1,0,0,0,40,0.8316,positive,4
2025-06-28 00:32:34,ITjobsinAlaska,lead cybersecurity software engineer lead cybersecurity software engineer focused full stack development security software engineer,,"jobs,NowHiring,jobpostings,ITJobs,InformationTechnology,TechnologyJobs",0,0,0,0,15,0.6124,positive,4
2025-06-28 00:30:02,michaeldstover,comfort freedom new professional,,"work,careers,jobs,freelancing,freelancers,freelancecareers,freelancerevolution,entrepreneurs,solopreneurs",0,0,0,0,16,0.7717,positive,4
2025-06-28 00:07:59,towandaism,attention job seekers career development opportunities,,"JobTraining,jobs,careers,jobopportunities,careeropportunities,JobFair,CareerFair,jobseekers,employment",0,0,0,0,6,0.3818,positive,2
2025-06-28 00:05:17,UPacificCareers,scarecrow win award outstanding field want stand job location join us,,"jobs,RocketJobs",0,0,0,0,5,0.9186,positive,0
2025-06-28 00:00:54,ecomprtal,rhodeskin hiring growth marketing manager los angeles hybrid check apply odeskin growth marketing manager,,"ecommerce,shopify,jobs,hiring",0,0,0,0,12,0.6369,positive,4
2025-06-28 00:00:36,theassurancegrp,decline doge changing job market decline doge changing job market,,"recruiting,jobs,hiring,recruiters",0,0,0,0,4,0.0,neutral,0
2025-06-28 00:00:18,foundrole,mental health therapist jobs across usa open positions hiring remote site nationwide find next opportunity view positions therapist jobs,,"Jobs,Hiring,MentalHealthTherapist",0,0,0,0,6,0.4215,positive,3
2025-06-28 00:00:01,echojobs__io,ericsson hiring software developer intern toronto ontario canada,,"javascript,python,html,angular,kubernetes,tech,softwareengineer,jobs,100daysofcode,100devs",1,0,0,0,86,0.0,neutral,4
2025-06-28 00:00:01,echojobs__io,ericsson hiring junior software developer poland,,"python,sql,git,bash,shell,tech,softwareengineer,jobs,100daysofcode,100devs",0,0,0,0,51,0.0,neutral,0
2025-06-28 00:00:01,echojobs__io,ericsson hiring lab cloud infrastructure engineer hungary budapest hungary,,"Infrastructure,python,microservices,machinelearning,kubernetes,docker,tech,softwareengineer,jobs",1,0,0,0,52,0.0,neutral,4
2025-06-28 00:00:01,tryremote,tempo seeking new frontend engineer frontend engineer tempo,,"hiring,jobs,remote",0,0,0,0,71,0.0,neutral,4
2025-06-27 23:41:01,ProBonoAust,regional gippsland multicultural services seek candidate chief executive officer gippsland multicultural services,,"JOBS,VIC",0,0,0,0,57,0.0,neutral,0
2025-06-27 23:35:55,UnlistedJobs,unlisted job alert role software developer location canada salary skills analytics data science angular javascript react scala genai employees,,"remote,jobs",0,0,0,0,37,0.296,positive,4
2025-06-27 23:30:00,ca_dsh,dsh multiple openings student assistant san bernardino ca,,"hiring,OpenUntilFilled,Jobs,Career,StudentAssistant",0,0,1,0,19,0.0,neutral,3
2025-06-27 23:30:00,ca_dsh,dsh one opening dietetic technician san bernardino ca,,"hiring,Apply,Jobs,Career,DieteticTechnician,NutritionServices",0,0,1,0,18,0.0,neutral,3
2025-06-27 23:30:00,ca_dsh,dsh one opening psychiatric technician san bernardino ca,,"hiring,Apply,Jobs,Career,PsychiatricTechnician,PsychTech,HealthCare",0,0,1,0,20,0.0,neutral,3
2025-06-27 23:30:00,ca_dsh,dsh one opening nurse practitioner atascadero ca,,"hiring,Apply,Jobs,Career,NursePractitioner,Nursing,Healthcare",0,0,1,0,13,0.0,neutral,3
2025-06-27 23:30:00,ca_dsh,dsh one opening associate governmental program analyst sacramento ca,,"hiring,Apply,Jobs,Career,AGPA,Analyst",0,0,1,0,14,0.0,neutral,3
2025-06-27 23:30:00,ca_dsh,dsh two openings information technology specialist sacramento ca,,"hiring,Apply,Jobs,Career,IT,InformationTechnology",0,0,1,0,16,0.0,neutral,3
2025-06-27 23:30:00,ca_dsh,dsh one opening office technician typing san bernardino ca,,"hiring,Apply,Jobs,Career,OfficeTechnician,OT,Clerical",0,0,1,0,23,0.0,neutral,3
2025-06-27 23:28:36,Toledo_PD,apply,,"ToledoPolice,Hiring,Jobs,Career,Toledo,LawEnforcement",3,0,0,0,511,0.0,neutral,2
2025-06-27 23:22:12,PinkJobsSite,onsite research study south glendale los angeles ca,,"jobpost,jobs,diversity",0,0,0,0,9,0.0,neutral,3
2025-06-27 23:17:08,PinkJobsSite,internet domain assessor dutch sr,,"diversity,vacancy,job",0,0,0,0,2,0.0,neutral,2
2025-06-27 23:16:04,SDBNJobs,regional marketing manager san diego ca ech jobs regional marketing manager san diego ca,,"biotech,jobs",0,0,0,0,42,0.0,neutral,3
2025-06-27 23:13:07,PinkJobsSite,online data analyst english us,,"jobs,hiring,inclusion",0,0,0,0,13,0.0,neutral,1
2025-06-27 22:49:21,DreamJobsAfrica,job alert see flyer details,,"Dreamjobs,Dreamjobs,Jobs",0,0,0,0,1,0.296,positive,2
2025-06-27 22:48:33,acejobsnigeria,ace jobs nigeria wms warehouse executive bat rehouse executive bat html spref tw,,"JobsInNigeria,jobseeker,recruitment,AceJobsNigeria",0,0,0,0,4,0.0,neutral,0
2025-06-27 22:48:12,DreamJobsAfrica,job alert see flyer details,,"Dreamjobs,Jobs",0,0,0,0,1,0.296,positive,2
2025-06-27 22:45:38,xdeputyHQ,ascentech services limited needs hire mechanical technician got relevant experience could good share someone might need details mechanical technicia,,"hiring,jobs,XDeputy",0,0,0,0,33,0.4939,positive,1
2025-06-27 22:45:12,xdeputyHQ,st dominic catholic hospital needs hire pharmacy technician got relevant experience could good share someone might need details pharmacy technician,,"hiring,jobs,XDeputy",0,0,0,0,25,0.6249,positive,1
2025-06-27 22:42:54,mustakbil,page seo backlink building specialist site post resume apply online,,"jobs,careers,hiring,vacancies,hiringnow",1,1,0,0,29,0.0,neutral,3
2025-06-27 22:42:51,mustakbil,looking seo sales closers post resume apply online,,"jobs,careers,hiring,vacancies,hiringnow",1,1,0,0,32,0.0,neutral,3
2025-06-27 22:42:51,mustakbil,looking seo sales agents post resume apply online,,"jobs,careers,hiring,vacancies,hiringnow",1,1,0,0,28,0.0,neutral,3
2025-06-27 22:42:48,mustakbil,physical therapist post resume apply online,,"jobs,careers,hiring,vacancies,hiringnow",1,1,0,0,22,0.0,neutral,3
2025-06-27 22:40:17,savingyourteeth,hiring endodontic practice sale albuquerque nm professional transition strategies albuquerque new mexico,,jobs,0,0,0,0,109,0.0,neutral,4
2025-06-27 22:36:11,CoyoteTech_Phil,quality inspector los angeles ca cb ac aca detail venue twitter,,"QualityControl,MechanicalInspector,LosAngeles,Aerospace,MedicalDevice,OpticalComparator,Micrometers,Calipers,Manufacturing,Jobs",0,0,0,0,11,0.0,neutral,3
2025-06-27 22:34:45,UnlistedJobs,unlisted job alert role systems engineer location united states salary skills hardware python aws jira groovy ansible jenkins terraform employees,,"remote,jobs",0,0,0,0,28,0.6124,positive,4
2025-06-27 22:33:34,UPacificCareers,best job ever ok maybe biased great jobs check retail support associate position,,"retailcareers,RocketJobs,jobs",0,0,0,0,3,0.9022,positive,0
2025-06-27 22:32:55,NavalNuclearLab,interested great career opportunity naval nuclear laboratory idaho facility hiring name take look next career,,"jobs,NNLJobs",0,0,0,0,26,0.8625,positive,2
2025-06-27 22:31:05,SFBNJobs,scientist cell therapy vivo delivery san francisco ca biotech jobs scientist cell therapy vivo delivery san francisco ca,,"jobs,biotech",0,0,0,0,43,0.0,neutral,3
2025-06-27 22:30:20,dapstats,tyx tnx irx fvx,,"macro,jobs,layoffs",2,0,1,0,97,0.2732,positive,2
2025-06-27 22:13:29,ArtFindingWork,make easy employers see value hiring ultimately realized interviewing mistake discussing done past value instead wanted employer future value ngwork make easy employers see utm campaign post utm medium web showwelcomeonshare false,,"gethired,jobs,employment,jobnsearch",1,0,0,0,8,0.8625,positive,3
2025-06-27 22:12:04,TXBionetworks,txbn jobs regional territory manager jobs regional territory manager utm source rss utm medium rss utm campaign regional territory manager,,"biotech,jobs",0,0,0,0,8,0.0,neutral,3
2025-06-27 22:10:17,ISAsigns,hiring custom sign graphic designer ramsay signs portland oregon,,jobs,0,0,0,0,91,0.0,neutral,4
2025-06-27 22:09:35,LatinosHigherEd,new job alert academic mentor philadelphia pennsylvania,,"career,jobs",0,0,0,0,10,0.296,positive,4
2025-06-27 22:07:29,BeormundSchool,hey experienced ta fancy new challenge check school website considering joining team,,"vacancy,job,school,supportstaff,schools,SEND,SEMH,Teaching,Assistant,classroom,support,team",0,0,0,0,12,0.0772,positive,2
2025-06-27 22:02:40,CVWarehouseJobs,floor manager,,"Jobs,withCVWarehouse",0,0,0,0,2,0.0,neutral,0
2025-06-27 22:01:23,pulse24ai,ai job displacement anthropic wants solutions anthropic tackles ai fallout utm source twitter utm medium organic social,,"anthropic,ai,economics,jobs,research",1,0,0,0,8,0.1779,positive,3
2025-06-27 22:00:40,JOchyberry,looking laundry attendants work buruburu outlet xpress laundry ladies good customer service sales send cv hr com mt kenya central kenya ugandans,nexgenfuelworks,"JoseOchyBerry,IkoKaziKE,IkoKazi,Jobs,SiriNiNumbers,AskGachagua,RutoMustGo",0,0,0,0,83,0.4404,positive,2
2025-06-27 21:56:24,Indiana_recruit,senior systems engineer description looking opportunity make impact leidos deliver innovative solutions tems engineer,,"HiringNow,jobsearch,hiring,jobs,JobOpening,Recruiting,InformationTechnology",0,0,0,0,15,0.7506,positive,0
2025-06-27 21:55:05,PersonnelPlus,personnel plus inc hiring customer service agent treasure valley customer service agent start,,"Jobs,IdahoStaffing",0,0,0,0,13,0.296,positive,2
2025-06-27 21:51:44,mustakbil,native korean customer service advisor job kuala lumpur malaysia post resume apply online,,"jobs,careers,hiring,vacancies,hiringnow",1,1,0,0,55,0.0,neutral,2
2025-06-27 21:51:13,IBD_MLarkin,hits record amid trade hopes july holiday report looms nke amzn,,"StockMarket,Trump,Jobs",0,0,0,0,177,0.5994,positive,2
2025-06-27 21:47:11,mustakbil,social media customer service agent post resume apply online,,"jobs,careers,hiring,vacancies,hiringnow",1,1,0,0,28,0.0,neutral,3
2025-06-27 21:45:47,workus_org,est gio em marketing infoaxis solutions,,"jobs,job,Toledo,Paran,Brazil",0,0,0,0,11,0.1779,positive,4
2025-06-27 21:40:17,tweetAONL,hiring director nursing start center cancer research dallas texas,,jobs,0,0,0,0,51,-0.6597,negative,4
2025-06-27 21:40:00,SM1Jobs,thats today thank back monday evening surrounding area,,"likes,follows,reposts,Jobs,Sutton,Merton,Carshalton,Wallington,Croydon,Cheam,Epsom,WorcesterPark,Wimbledon,Banstead,Tadworth,London,SuttonJobs,SM1Jobs",0,0,0,0,77,0.3612,positive,2
2025-06-27 21:35:36,ITLouisiana,system administrator mantech seeks motivated career customer oriented system administrator join team columbia md team inistrator,,"SoftwareJobs,Recruiting,jobs,RemoteTechJobs,InformationTechnology",0,0,0,0,4,0.6369,positive,2
2025-06-27 21:35:25,thegigsguy,jag physical therapy hiring home physical therapist toms river nj utm source twitter,,"jobs,hiring",0,0,0,0,6,0.0,neutral,3
2025-06-27 21:35:24,thegigsguy,panera bread hiring salad sandwich maker columbia mo da utm source twitter,,"jobs,hiring",0,0,0,0,15,0.0,neutral,3
2025-06-27 21:35:24,thegigsguy,sanford health hiring rn care manager adult weight management days fargo nd bb bb ec utm source twitter,,"jobs,hiring",0,0,0,0,13,0.4939,positive,0
2025-06-27 21:35:24,thegigsguy,higginbotham brothers hiring yard warehouse rep denver city tx dcfd utm source twitter,,"jobs,hiring",0,0,0,0,8,0.3612,positive,3
2025-06-27 21:35:24,thegigsguy,genesis logistics hiring cdl class delivery drivers nighttime san diego ca fa aeca utm source twitter,,"jobs,hiring",0,0,0,0,11,0.0,neutral,3
2025-06-27 21:35:23,thegigsguy,america best hiring optometric technician medical assistant bilingual brandon fl bc bd utm source twitter,,"jobs,hiring",0,0,0,0,6,0.6369,positive,3
2025-06-27 21:35:23,thegigsguy,west fraser hiring electrician russellville ar fa utm source twitter,,"jobs,hiring",0,0,0,0,4,0.0,neutral,3
2025-06-27 21:35:23,thegigsguy,proampac hiring production team member claremont nh bb utm source twitter,,"jobs,hiring",0,0,0,0,5,0.4939,positive,3
