timestamp,username,tweet,mentions,hashtags,likes,retweets,comments,replies,views,compound,sentiment,topic
2025-06-27 16:07:04,ColaberrySODA,ever question studying colaberry problem solved ai mentor available time topic challenge start,,"colaberry,ai,dataanalyst,jobs",0,0,0,0,17,-0.0772,negative,4
2025-06-27 16:04:04,MWBionetworks,mwbn jobs analytical scientist st louis mo cience jobs analytical scientist st louis mo utm source rss utm medium rss utm campaign analytical scientist st louis mo,,"biotech,jobs",0,0,0,0,5,0.0,neutral,3
2025-06-27 16:03:00,wlpjobs,back market hiring senior product designer japan,,"productdesigner,productjobs,jobs",1,0,0,0,119,0.0,neutral,4
2025-06-27 16:02:46,SouthCoastAQMD,south coast aqmd assistant air quality specialist ceqa deputy district counsel senior ii facilities services technician office design project coordinator career development intern details,,"NowHiring,jobs,greenjobs",1,1,0,0,335,0.0,neutral,0
2025-06-27 16:02:34,JCPInEastAndMid,logistics tech returns administrator location northamptonshire click link find apply,YusenLogisticsE,"Wellingborough,NorthantsJobs,Jobs",0,0,0,0,62,0.0,neutral,2
2025-06-27 16:02:00,wlpjobs,cloudflare hiring sr product manager gtm levittown,,"productmanager,productjobs,jobs",0,0,0,0,66,0.0,neutral,4
2025-06-27 16:01:00,wlpjobs,xero hiring product marketing manager signup onboarding sydney,,"productmarketingmanager,productjobs,jobs",0,0,0,0,63,0.0,neutral,4
2025-06-27 16:00:31,DonnaBayless5,imagine getting remote job offers without ever applying someone kers comments fdpeg landed multiple remote job offers remote,,"JobSeeker,CareerTips,RemoteWork",0,0,0,0,2,0.0,neutral,4
2025-06-27 16:00:24,JCPinGloucester,great week thankyou joining us back tuesday still advice support coming way pm tonight weekend great weekend jodie,,"Gloucestershire,Jobs,Jobsearch",0,0,0,0,14,0.8979,positive,0
2025-06-27 16:00:15,jobrecurit,solidity developer serokell location remote serokell fast growing fully remote software development company works innovative solut apply,,"CryptoJobs,Web3,DeFi,RemoteJobs,jobs,Crypto",1,0,1,0,20,0.5574,positive,0
2025-06-27 15:59:00,wlpjobs,gusto hiring product marketing manager platform denver,,"productmarketingmanager,productjobs,jobs",0,0,0,0,58,0.0,neutral,4
2025-06-27 15:58:53,CritMinJrnl,canada critical minerals push could create jobs booming demand lithium copper nickel time enhance mining infrastructure let build energy superpower empower indigenous communities,,"Mining,Jobs,Innovation",0,0,0,0,37,0.1027,positive,2
2025-06-27 15:58:49,AgileUAE,urgent jobs apply,,"Hiring,Recruitment,Networking,Jobs,Careers,ApplyNow,AgileConsultants",0,0,0,0,17,0.2023,positive,2
2025-06-27 15:58:00,wlpjobs,getyourguide hiring senior product manager berlin,,"seniorproductmanager,productjobs,jobs",0,0,0,0,55,0.0,neutral,4
2025-06-27 15:57:00,wlpjobs,nabla hiring senior product designer paris,,"productdesigner,productjobs,jobs",1,0,0,0,106,0.0,neutral,4
2025-06-27 15:56:00,wlpjobs,flo hiring senior product marketing manager vilnius,,"productmarketingmanager,productjobs,jobs",0,0,0,0,67,0.0,neutral,4
2025-06-27 15:55:43,AndyTallentire,division based designer imaginative hospitality environments major brands chains seek architectural technician architectural technician warwickshire,,"Warwickshire,designjobs,interiors,interiordesign,interiorarchitect,wfh,autocad,vectorworks,jobs,coffeeshops",0,0,0,0,41,0.0,neutral,2
2025-06-27 15:55:12,BROADWING_JOBS,job title solar panel installer apply job lar panel installer,,"malta,eu,customercare,engineering,technical,communication,electrical,drivinglicence,installation,maintenance,reporting,teamwork,jobs,recruitment,staffing,employment,jobsearch",0,0,0,0,22,0.0,neutral,2
2025-06-27 15:49:47,Choice1Temps,administrator cape coral hour accounting apply click,,"job,jobs,hiring,SecretarialJobs",0,0,0,0,9,0.0,neutral,2
2025-06-27 15:49:28,Choice1Temps,warehouse assembly fitchburg hour assembly apply click,,"job,jobs,hiring,ManufacturingJobs",0,0,0,0,6,0.0,neutral,2
2025-06-27 15:49:06,Choice1Temps,accounting clerk massachusetts hour accounting apply click,,"job,jobs,hiring,AccountingJobs",0,0,0,0,6,0.0,neutral,2
2025-06-27 15:49:00,wlpjobs,gympass hiring pessoa ux writer nior vaga afirmativa remote,,"uxwriter,productjobs,jobs,remotejobs",0,0,0,0,54,0.0,neutral,4
2025-06-27 15:48:45,Choice1Temps,shipper receiver woodstock hour shipping apply click,,"job,jobs,hiring,ManufacturingJobs",0,0,0,0,3,0.0,neutral,2
2025-06-27 15:48:24,Choice1Temps,production associate millbury hour assemblers apply click,,"job,jobs,hiring,ManufacturingJobs",0,0,0,0,5,0.0,neutral,2
2025-06-27 15:48:10,orbit_careers,leave last job sample answers ave last job utm source reviveoldpost utm medium social utm campaign reviveoldpost,,"Career,Jobsearch,Job,Jobs,InterviewTips",0,0,0,0,1,-0.0516,negative,3
2025-06-27 15:46:21,Choice1Temps,general laborer woodstock hour apply click,,"job,jobs,hiring,ManufacturingJobs,applynow,jobs",0,0,0,0,3,0.0,neutral,2
2025-06-27 15:46:10,Choice1Temps,staffing account manager leominster hour apply click,,"job,jobs,hiring,SalesJobs,choice1temps",0,0,0,0,4,0.0,neutral,2
2025-06-27 15:46:02,gracey_chika,days go countdown officially applying luck refreshing job boards like devotion praying yes never comes pre order,,"jobs,JobSearch,jobseekers,gracey,ebook",3,0,0,0,12,0.9136,positive,0
2025-06-27 15:46:00,IntlFinTech,fintech movers shakers appoints adrian mcphee chief technology officer accelerate ai powered banking vision nts adrian mcphee chief technology officer accelerate ai powered banking vision,Backbase,"moversandshakers,jobs,fintechjobs,banking,fintech,fintechnews,financialtechnology,AI,artificialintelligence,AInews",0,0,0,0,7,0.5106,positive,4
2025-06-27 15:45:51,Choice1Temps,cnc machinist dudley hour com apply click,,"job,jobs,hiring,EngineeringJobs,choice1temps",0,0,0,0,5,0.0,neutral,2
2025-06-27 15:45:33,YSBES_Ottawa,employment ontario believe strength diversity employment ontario programs designed support individuals diverse backgrounds experiences abilities find jobs,,"EmploymentOntario,Ottawa,Employment,Jobs,FreeSupport,HereForYou",1,0,0,0,15,0.7845,positive,2
2025-06-27 15:42:33,IslandFutures,looking work training download copy latest education employment training opportunities bulletin,,"apprenticeships,Jobs,IsleofWight",0,0,0,0,2,0.3818,positive,2
2025-06-27 15:41:07,ghana_career,male candidates preferred must living koforidua aflao hohoe cape coast salary ghs immediate days joiners required field sales executive senior field sales executive experience years industry home appliances key,,vacancy,1,0,1,0,141,0.0,neutral,0
2025-06-27 15:40:48,ghana_career,impact investing ghana iigh invites applications position programme assistant support implementation activities ghana research industry collaborative gric role presents exciting opportunity contribute national,,vacancy,1,0,1,0,163,0.8271,positive,2
2025-06-27 15:40:19,savingyourteeth,hiring endodontist confidential grants pass oregon,,jobs,0,0,0,0,91,0.2263,positive,4
2025-06-27 15:40:08,ghana_career,job description secretary accounting background industry media job title secretary location nungua addogono job summary seeking highly organized detail oriented secretary accounting background provide administrative support,,vacancy,1,0,1,0,114,0.4019,positive,0
2025-06-27 15:38:43,AlexanderMaeLtd,temporary marketing administrator opportunity location central bristol hybrid working available pay per hour hours monday friday pm duration months find apply marketing administrator per hour sn,,"recruitment,bristol,jobs",0,0,0,0,9,0.34,positive,2
2025-06-27 15:38:40,ghana_career,category job vacancy deadline june th maintenance supervisor july th finance officer role title finance officer maintenance supervisor company matrix gas ghana limited responsibilities finance officer financial,,vacancy,1,0,1,0,118,-0.2263,negative,2
2025-06-27 15:38:26,DeeCherilyna,needs linkedin message right people one person got multiple job offers way kers comments fdpeg landed multiple remote job offers remote,,"RemoteWork,DigitalNomad,JobSeeker",0,0,0,0,2,0.0,neutral,4
2025-06-27 15:38:23,Job_Energy,air force operational energy data analyst description leidos seeking air force data analyst support operational energy office deputy operational energy data analyst,,"jobpostings,Recruiting,HiringNow,jobs",0,0,0,0,4,0.7906,positive,1
2025-06-27 15:35:33,VistaarNews,seedhe mudde ki baat,"gyanendrat1,ChhattisgarhCMO,vishnudsai","Chhattisgarh,CGNews,VishnuDeoSai,Jobs,SeedheMuddeKiBaat,GyanendraTiwari,VistaarNews",1,0,0,0,85,0.0,neutral,2
2025-06-27 15:32:23,EqualJobsUK,last chance apply operations lead role eccan applications close sunday th june follow link apply operations lead,,"Operationslead,Climatejobs,ClimateAction,Environmentjobs,Communitydevelopment,Edinburgh,Jobs2025,EthnicMinority,Jobs",0,0,0,0,11,0.25,positive,2
2025-06-27 15:31:16,CareerSourceNEF,check transportation employer spotlight week coca cola beverages open positions job details go employ florida use job order number check transportation information,,"jobseekers,jobs",0,0,0,0,22,0.0772,positive,2
2025-06-27 15:31:04,SFBNJobs,research associate pharma foster city ca biotech jobs research associate pharma foster city ca,,"jobs,biotech",0,0,0,0,23,0.0,neutral,3
2025-06-27 15:30:24,HRTechSeries,preference single centralised platform evident employees favouring one solution reduce time wasted switching tools,,"hr,recruitment,recruiting,jobs,jobsearch,career,Hiring,TalentAcquisition,HiringNow",0,0,0,0,15,0.1027,positive,4
2025-06-27 15:30:14,JCPInEastAndMid,food beverage team leader national trust based click apply,,"Grantham,LincsJobs,Jobs",0,0,0,0,48,0.5106,positive,2
2025-06-27 15:29:04,PinkJobsSite,customer service representative ii,,"jobs,hiring,newrole",0,0,0,0,11,0.0,neutral,2
2025-06-27 15:27:52,UPacificCareers,best job ever ok maybe biased great jobs check assistant store manager position,,"retailcareers,jobs,retailjobs",0,0,0,0,1,0.8555,positive,2
2025-06-27 15:23:05,NICOGroupMalawi,applicants invited apply post accounting associate send application via email recruitment co mw,eris,"Vacancy,OneNICO,ZikumvekaKumbuyoko",0,0,0,0,43,0.0,neutral,2
2025-06-27 15:23:04,KPIEducation,graduate trainee maths teacher leicester week apply click,,"job,jobs,hiring,EducationJobs",0,0,0,0,61,0.0,neutral,2
2025-06-27 15:22:40,KPIEducation,graduate trainee music teacher leicester year apply click,,"job,jobs,hiring,EducationJobs",0,0,0,0,56,0.0,neutral,2
2025-06-27 15:22:12,acrrecruitment,level nursery practitioner nppb peterborough hour apply click,,"job,jobs,hiring,EducationJobs",0,0,0,0,2,0.0,neutral,2
2025-06-27 15:22:11,TalentFinderPre,net web developer haywards heath year apply click,,"job,jobs,hiring,ITJobs",0,0,0,0,39,0.0,neutral,2
2025-06-27 15:21:13,Ambreen280,social media post graphic design,,"hope,dream,trending,socialmediapostdesigner,jobs,Pakistan,moharram,contenttips,socialmediamarketing,Designtips,MobileDesign,ArtAndDesign,DigitalArt,CreativeDesign,Graphicdesigner,motivation,PosterDesign,amberkhan",1,0,0,0,33,0.0,neutral,3
2025-06-27 15:20:25,deptoflabour,wearehiring sure check department employment labour website latest job openings vacancies list aspx deadline july,,"jobs,Yazini,ServicedeliveryZA,GovZAUpdates,YouthMonth2025",3,4,0,0,489,0.3182,positive,2
2025-06-27 15:17:24,ITLouisiana,developer net core python developer developer net core python developer job posting net core python developer,,"ITJobs,Techjobs,hiring,ITJobPro,jobpostings,jobs,ITSupportJobs,TechCareers,ITCareers,ProgrammingJobs",0,0,0,0,19,0.0,neutral,0
2025-06-27 15:17:16,PASAEinfo,matter area interest expertise may position within association perfect check current job openings association industry,,"PASAE,Associations,BusinessSuppliers,JobPostings,Jobs,Hiring",0,0,0,0,6,0.7783,positive,2
2025-06-27 15:13:54,thipuhoney,agriculture department kodagu recruitment apply taluk technical manager post partment kodagu recruitment,,"KodaguRains,Jobs,job",0,0,0,0,13,0.0,neutral,2
2025-06-27 15:05:45,bittalentglobal,go fish digital hiring organic social media specialist remote raleigh nc full time degree mentioned apply,,"jobs,unemployment,JobSeekersSA,bittalent,ad",0,0,0,0,17,0.0,neutral,0
2025-06-27 15:05:45,bittalentglobal,freeman capital hiring social media manager remote anywhere days ago work home part time degree mentioned apply,,"jobs,unemployment,JobSeekersSA,bittalent,ad",0,0,0,0,81,0.4019,positive,0
2025-06-27 15:05:45,bittalentglobal,digital media management hiring jr social media manager tv los angeles ca full time degree mentioned apply,,"jobs,unemployment,JobSeekersSA,bittalent,ad",0,0,0,0,34,0.0,neutral,0
2025-06-27 15:05:44,bittalentglobal,blueprint technologies hiring junior social media manager blueprint technologies remote united states days ago full time dental insurance health insurance paid time apply,,"jobs,unemployment,JobSeekersSA,bittalent,ad",0,0,0,0,62,0.4215,positive,0
2025-06-27 15:05:44,bittalentglobal,rumor advertising hiring junior social media specialist anywhere work home full time degree mentioned dental insurance paid time health insurance apply,,"jobs,unemployment,JobSeekersSA,bittalent,ad",0,0,0,0,8,0.0,neutral,0
2025-06-27 15:05:44,bittalentglobal,growe hiring junior social media manager anywhere days ago work home full time degree mentioned apply,,"jobs,unemployment,JobSeekersSA,bittalent,ad",0,0,0,0,33,0.0,neutral,0
2025-06-27 15:05:05,lpamanian,apply,,"JobFair,USPSCareers,Californiajobs,hiring,JOBS,jobsearch,joinourteam,USPS,USPSEmployee,USPSEmployee",1,0,0,0,6,0.0,neutral,2
2025-06-27 15:03:05,acrrecruitment,level nursery practitioner npl lea leamington spa year apply click,,"job,jobs,hiring,EducationJobs",0,0,0,0,15,0.0,neutral,2
2025-06-27 15:01:53,wrexhamcbc,job experienced social worker team older people something could find,,"Job,Jobs,Hiring",0,0,0,0,422,0.0,neutral,2
2025-06-27 15:00:20,JCPSurreySussex,staff needed shell chichester info,Shell,"Jobs,CustomerServiceJobs,WestSussex,Chichester",0,0,0,0,42,0.0,neutral,0
2025-06-27 15:00:15,uiuxjobsboard,hot design opportunity join innovative team superside ui visual designer remote latin america work projects challenge inspire apply mote latin america ui visual designer,,"uxdesign,jobs,tech",0,0,0,0,35,0.8979,positive,4
2025-06-27 15:00:15,Motorsport_Jobs,join performance engineer apply ance engineer,HMSGOfficial,"motorsportjobs,motorsport,jobs,jobalert,autosport,jobsinmotorsport,hiring",1,1,0,0,299,0.296,positive,4
2025-06-27 15:00:03,resumespice,passion resumespice effectively positioning job seekers job career dreams,,"jobseeker,dreamjob,resumwriting",0,0,0,0,2,0.8225,positive,2
2025-06-27 14:59:06,HYAsearch,milwaukee public schools wi schools officer application deadline june,,"Chief,HYAsearch,Education,Jobs,EducationJobs,edleadership,edadmin",0,0,0,0,69,0.0,neutral,2
2025-06-27 14:57:05,GovernmentCIO,perfecting job application got easier need make quick edit govcio career portal makes updates simple apply confidence questions visit faq page,,"Careers,Hiring,Jobs",0,0,0,0,10,0.8555,positive,2
2025-06-27 14:57:01,MSSProgram,screener per hour ends explore today bs screener,,"hiring,jobs,tehamacounty,Recruitment,career,opportunities",0,0,0,0,8,0.0,neutral,2
2025-06-27 14:57:00,acrrecruitment,senior room leader nursery practitioner srmnpox oxfordshire year apply click,,"job,jobs,hiring,EducationJobs",0,0,0,0,1,0.0,neutral,2
2025-06-27 14:56:47,TenPercentLegal,residential conveyancing locum abingdon july august dates office based role abingdon hour estimated apply click,,"job,jobs,hiring,LegalJobs",0,0,0,0,13,0.0,neutral,2
2025-06-27 14:56:13,ScotGovSASA,opportunity farm trials assistant join team visit info,ScotGovSASA,"jobs,ApplyNow",0,0,0,0,46,0.6124,positive,2
2025-06-27 14:49:24,Earthworksjobs,phd position past present future global inland water methane budget utrecht netherlands echt,,"jobs,research,PhD,EarthSciences,EnvironmentalScience,ClimateScience,EarthSystem,biogeochemistry,hydrology,limnology,climatechange",1,2,1,0,486,0.0,neutral,4
2025-06-27 14:48:35,PinkJobsSite,director education business development,,"vacancy,newrole,inclusion",0,0,0,0,4,0.0,neutral,4
2025-06-27 14:47:51,mustakbil,looking seo page page expert post resume apply online,,"jobs,careers,hiring,vacancies,hiringnow",1,1,1,0,32,0.0,neutral,3
2025-06-27 14:42:54,New_Job_Today,summer overview state current uk job market outlook summer,,"jobs,jobmarket",0,0,0,0,22,0.0,neutral,2
2025-06-27 14:42:49,ProcyonTec,today actions foundation tomorrow success,,"JavaArchitect,SoftwareArchitect,SolutionArchitecture,TechArchitect,EnterpriseArchitecture,JavaDevelopment,SpringBoot,jobs,career,MicroservicesArchitecture,JavaDesignPatterns,CloudArchitecture,AWSArchitect",0,0,0,0,5,0.5719,positive,2
2025-06-27 14:40:17,AcademyofAuD,hiring audiologist hearing instrument specialist atlanta hearing associates conyers ga,,jobs,0,0,0,0,96,0.0,neutral,4
2025-06-27 14:40:14,AJRecruiting,field service enfnhamgineer specialist forklifts farnham year van door door overtime apply click,,"job,jobs,hiring,EngineeringJobs",0,0,0,0,1,0.0,neutral,2
2025-06-27 14:38:39,xaib_crypto461,hey folks hiring community moderators paid based hours worked schedule fully flexible interested slide dms let talk,,"web3,moderatorjobs,hiring,community,mod,jobs,moderators",2,0,3,0,49,0.6335,positive,4
2025-06-27 14:30:24,Javascriptjobbs,hiring help scout frontend engineer location remote united states jobeulokzpleh frontend engineer help scout utm medium social,,"javascript,reactjs,nodejs,vuejs,jobs,hiring",0,0,0,0,152,0.802,positive,4
2025-06-27 14:30:15,JCPBedsAndHerts,account executive required currys stevenage herts info apply,currys,"RetailJobs,SalesJobs,Stevenage,Herts,Jobs",0,0,0,0,55,0.0,neutral,0
2025-06-27 14:30:14,JCPInEastAndMid,vehicle technician level based click apply,RoyalMail,"Nottingham,NottsJobs,Jobs",0,0,0,0,36,0.0,neutral,2
2025-06-27 14:30:10,GreenJobsIRL,head policy regulation month maternity cover,,"jobs,climatechange",0,0,0,0,5,0.0,neutral,2
2025-06-27 14:30:00,careersinracing,create job alert first apply get daily alerts latest jobs sent directly inbox horse care marketing sales administration start alerts,,"CareersinRacing,Jobs",0,0,1,0,268,0.7579,positive,2
2025-06-27 14:30:00,ClearedJobsNet,cyber security jobs massachusetts fosec,,"cybersecurity,cyber,cloud,jobs,MA",0,0,0,0,32,0.34,positive,4
2025-06-27 14:28:20,APPersonnel,administrator servicing team guernsey guernsey market related apply click,,"job,jobs,hiring,BankingJobs,pensions,admin,guernsey",0,0,0,0,7,0.0,neutral,0
2025-06-27 14:28:12,APPersonnel,trainee claims administrator guernsey guernsey market related apply click,,"job,jobs,hiring,GraduateJobs,trainee,insurance,guernsey",0,0,0,0,5,0.0,neutral,0
2025-06-27 14:28:03,APPersonnel,assistant manager fund administration guernsey guernsey market related apply click,,"job,jobs,hiring,BankingJobs,funds,guernsey,hiringnow",0,0,0,0,5,0.0,neutral,0
2025-06-27 14:14:40,ALA_JobLIST,children librarian town greenwich greenwich library greenwich ct,,"libraryjobs,libraryjob,LISjobs,libjobs,jobs",1,0,0,0,74,0.0,neutral,2
2025-06-27 14:12:20,TalentFinderPre,data processing assistant london annum apply click,,"job,jobs,hiring,SecretarialJobs",0,0,0,0,3,0.0,neutral,2
2025-06-27 14:06:56,kid_sit,babysitting job babysitter parent helper wanted preschooler oceanside california usa apply oceanside ca us,,"babysitting,childcare,jobs,Oceanside",1,0,0,0,19,0.34,positive,2
2025-06-27 14:05:51,Remarkable_jobs,commercial membership manager bracknell year apply click,,"job,jobs,hiring,SalesJobs,membership",0,0,0,0,4,0.0,neutral,2
2025-06-27 14:05:48,Javascriptjobbs,hiring simple technology solutions web developer location remote united states jobwss ypelpmis web developer simple technology solutions utm medium social,,"javascript,reactjs,nodejs,vuejs,jobs,hiring",0,0,0,0,102,0.6369,positive,4
2025-06-27 14:03:49,Remarkable_jobs,property sales manager farnborough year ote apply click,,"job,jobs,hiring,PropertyJobs,property",0,0,0,0,16,0.0,neutral,2
2025-06-27 14:02:59,MaiPlacements,director operations brooklyn ny seeking director operations key operations manager responsible overseeing janitorial department buildings tier yanky com,maiplacement,"Jobs,HiringNow,hiring,NewYork,operationsdirector",0,0,0,0,12,0.3182,positive,4
2025-06-27 14:02:51,Remarkable_jobs,lettings negotiator reading year ote apply click,,"job,jobs,hiring,PropertyJobs,LettingsNegotiator",0,0,0,0,1,0.0,neutral,2
2025-06-27 14:02:47,PoundPave101,job seekers know saying get pay approach really want take career clients landing jobs faster searching,,"jobs,JobSearch,careers,jobalerts,resumes,interviews",0,0,1,0,5,0.0498,neutral,2
2025-06-27 14:00:33,theassurancegrp,business development opportunity nyc see website details,,"recruiting,jobs,nycjobs,busdevjobs,recruiters",0,0,0,0,4,0.4215,positive,1
2025-06-27 14:00:14,jobrecurit,senior rust engineer research solana core specialist raiku location remote stay loop apply cb bc cc,,"CryptoJobs,Web3,DeFi,RemoteJobs,jobs,Crypto",0,0,0,0,19,0.0,neutral,4
2025-06-27 14:00:11,foundrole,registered nurse float pool jobs across usa open positions hiring remote site nationwide find next opportunity view positions se float pool jobs,,"JobAlert,Jobs,RegisteredNurseFloatPool",0,0,0,0,3,0.4215,positive,3
2025-06-27 14:00:02,SimpleApply_AI,boss called suddenly happiest department earth,,"SimpleApplyAl,ai,jobsearch,jobs,jobseekers,remotejob",0,0,0,0,16,0.6369,positive,2
2025-06-27 14:00:00,ipsofootball,level book level course sign forget free workshops book ball comfree workshops,followers,"personaldevelopment,jobs,scouting,recruitment",0,0,0,0,97,0.34,positive,2
2025-06-27 13:58:18,TenPercentLegal,conveyancing locum july full time remote chipstead hour estimated apply click,,"job,jobs,hiring,LegalJobs",0,0,0,0,9,0.0,neutral,2
2025-06-27 13:56:03,WOBionetworks,wobn jobs research scientist project temporary seattle wa gon biotech jobs research scientist project temporary seattle wa utm source rss utm medium rss utm campaign research scientist project temporary seattle wa,,"biotech,jobs",0,0,0,0,27,0.0,neutral,3
2025-06-27 13:55:52,TalentFinderPre,customer service desk operator newport pa apply click,,"job,jobs,hiring,CustomerServiceJobs",0,0,0,0,3,0.0,neutral,2
2025-06-27 13:55:34,HRTechSeries,calyptus launches new ai hiring platform close global productivity gap,,"hr,recruitment,recruiting,jobs,jobsearch,career,Hiring,TalentAcquisition,HiringNow,JobAlerts,JobSeeker",0,0,0,0,11,0.0,neutral,4
2025-06-27 13:55:13,election_pandit,job title indika research hiring political ground management professionals maharashtra location maharashtra indika research hiring political ground management professionals maharashtra,,"Job,Politicaljob,Maharashtra,Political,Vacancy,Management,Electionpandit",1,0,0,0,8,0.0,neutral,4
2025-06-27 13:50:41,chalky105,climbing instructor cambridge year apply click,,"job,jobs,hiring,EducationJobs,Job,Cambridge,Climbing",0,0,0,0,12,0.0,neutral,2
2025-06-27 13:49:57,sridhar_3009,adtran hiring software engineer comment adtran link,,"software,hiring,jobs,jobshiring,jobsinindia,careercrate,softwaredevelopment",0,0,0,0,22,0.0,neutral,4
2025-06-27 13:45:10,Renewablejobs_,head policy regulation month maternity cover,,"jobs,renewableenergy",0,0,0,0,12,0.0,neutral,2
2025-06-27 13:44:34,networx_recruit,,,"Jobs,FundraisingDevelopmentManager,Newark,Hybrid,Fundraising,Manager,Hiring",0,0,0,0,10,0.0,neutral,2
2025-06-27 13:43:17,PublicHealthSD,hiring program assistant highly motivated health professional join team employment opportunities program assistant job opportunity,,"25,Sudbury,Jobs,PublicHealth",1,0,0,0,82,0.8718,positive,2
2025-06-27 13:39:24,TechnoWise_ind,recruiters know kind pain effort high vain things recruiters relate often clients say get one option compare follow,,"Recruitment,Recruiter,Jobs,Meme,India,HR,CricketTwitter,Cricket,ENGvsIND,TechnoWise_India",1,1,0,0,18,-0.4019,negative,2
2025-06-27 13:35:52,chalky105,faculty wellbeing consultant brighton year apply click,,"job,jobs,hiring,EducationJobs,job,University,Wellbeing",0,0,0,0,17,0.0,neutral,2
2025-06-27 13:34:57,TenPercentLegal,property locum hampshire full time office based role alton hour estimated apply click,,"job,jobs,hiring,LegalJobs",0,0,0,0,12,0.0,neutral,2
2025-06-27 13:31:56,ErBrij2012,,"UPGovt,myogiadityanath,EduMinOfIndia","TGT2022Exam,Exam,Jobs,teacher",0,0,0,0,2,0.0,neutral,2
2025-06-27 13:30:26,networkleeds,thrive leeds looking youth support worker join team check details deadline th july part time pro rata,,"jobs,vacancy,parttime,leedsjobs,churchjobs,youthworker",0,0,0,0,17,0.5994,positive,2
2025-06-27 13:27:23,illbeback_jobs,data platform ai tech lead servicenow orm ai tech lead feed id unique id follow updated new,,"jobs,AI,ML,AIJobs,AITalent,hiring,Leadership,Hyderabad",0,0,0,0,43,0.0,neutral,4
2025-06-27 13:27:10,EnvironmentJob_,head policy regulation month maternity cover,,"jobs,environment",0,0,0,0,45,0.0,neutral,2
2025-06-27 13:24:02,Wooduchoose,bournemouth poole college lecturer carpentry joinery bournemouth uk,,"woodworking,joblisting,jobs",0,0,0,0,21,0.0,neutral,2
2025-06-27 13:21:44,mustakbil,senior multimedia specialist post resume apply online,,"jobs,careers,hiring,vacancies,hiringnow",1,1,0,0,22,0.0,neutral,3
2025-06-27 13:21:44,mustakbil,multimedia specialist post resume apply online,,"jobs,careers,hiring,vacancies,hiringnow",1,1,0,0,20,0.0,neutral,3
2025-06-27 13:21:24,DiedreMoire,field mechanic snack chip cooking packaging equipment toledo oh diedremoire,,"JobSearch,JobHunt,JobOpening,Hiring,Job,Jobs,Careers,Employment,jobposting,fieldeservicejobs,technicianjobs",0,0,0,0,6,0.0,neutral,0
2025-06-27 13:21:15,cryptonews,crypto job market booming blockchain devs smart contract engineers zk cryptographers ai blockchain integration engineers high demand,,"Crypto,Jobs,Bitcoin",1,1,0,0,1073,0.296,positive,0
